{
  "artifact_version": "2.31",
  "component_revision": "2",
  "component_semantics_version": "2.31",
  "contract_set_id": "BOIS-GATE-CONTRACTS-2.31",
  "contracts": [
    {
      "adversarial_fixture_ref": "fixtures/GATE_FIXTURES.json#/fixtures/C00/adversarial",
      "canonical_object_projection": {
        "assessment_objects": [
          "Input Container",
          "Source"
        ],
        "output_objects": [
          "Phenomenon"
        ],
        "primary_object": "Phenomenon"
      },
      "execution_receipt_ref": "validation/PREPACK_TEST_EXECUTION_RECEIPTS.jsonl#test_id=TEST-GATE-C00-POSITIVE",
      "gate_id": "C00",
      "hold_condition": "Recoverable schema or semantic incompleteness without a fundamental violation.",
      "hold_return_state": "C00",
      "input_schema_ref": "schema/GATE_CONTEXT_SCHEMAS.json#/$defs/GateContextC00",
      "name": "INPUT_CAPTURED",
      "negative_fixture_ref": "fixtures/GATE_FIXTURES.json#/fixtures/C00/negative",
      "next_phase": "C01",
      "owner": "O003",
      "pass_condition": "Schema-valid context, closed runtime evidence, semantic predicate TRUE, exact next-phase transition, and no STOP boundary.",
      "positive_fixture_ref": "fixtures/GATE_FIXTURES.json#/fixtures/C00/positive",
      "predicate": {
        "op": "schema_valid",
        "schema_ref": "schema/GATE_CONTEXT_SCHEMAS.json#/$defs/GateContextC00"
      },
      "required_evidence": [
        "typed CycleObjectStore",
        "current GateEvidence bound to the exact context digest",
        "all declared runtime references resolve in the current cycle and scope"
      ],
      "required_evidence_contract": {
        "allowed_source_classes": [
          "CURRENT_RUNTIME",
          "AUTHORIZED_SOURCE",
          "INDEPENDENT_REVIEW"
        ],
        "context_digest_excludes": [
          "runtime_registry"
        ],
        "exact_cycle_binding": true,
        "exact_revision_binding": true,
        "exact_scope_binding": true,
        "gate_evidence_owner": "O003",
        "gate_evidence_type": "GateEvidence",
        "known_object_types_required": true,
        "minimum_evidence_count": 1,
        "object_bindings": [
          {
            "context_path": "phenomenon",
            "freshness": "CURRENT",
            "id_path": "phenomenon_id",
            "object_type": "Phenomenon",
            "owner": "O001",
            "source_class": "CURRENT_RUNTIME"
          }
        ],
        "object_id_uniqueness_required": true,
        "object_payload_required": true,
        "reference_bindings": [
          {
            "context_path": "source_ref",
            "freshness": "CURRENT",
            "minimum_count": 1,
            "object_type": "Source",
            "owner": "O009",
            "source_class": "AUTHORIZED_SOURCE"
          }
        ],
        "registry_lifecycle_state_required": "ACTIVE",
        "registry_path": "runtime_registry",
        "registry_type": "CycleObjectStore",
        "required_freshness": "CURRENT"
      },
      "semantic_predicate": {
        "args": [
          {
            "op": "nonempty",
            "path": "literal_input"
          },
          {
            "op": "nonempty",
            "path": "phenomenon.phenomenon_id"
          },
          {
            "op": "nonempty",
            "path": "phenomenon.revision"
          },
          {
            "left_path": "phenomenon.identification_source",
            "op": "equals",
            "right_path": "source_ref"
          },
          {
            "equals": "C01",
            "op": "fact",
            "path": "next_transition"
          }
        ],
        "op": "all"
      },
      "stop_condition": "Fundamental invariant violation or prohibition."
    },
    {
      "adversarial_fixture_ref": "fixtures/GATE_FIXTURES.json#/fixtures/C01/adversarial",
      "canonical_object_projection": {
        "assessment_objects": [
          "Phenomenon",
          "Unknown",
          "Risk"
        ],
        "output_objects": [
          "BoundaryRecord",
          "Unknown"
        ],
        "primary_object": "BoundaryRecord"
      },
      "execution_receipt_ref": "validation/PREPACK_TEST_EXECUTION_RECEIPTS.jsonl#test_id=TEST-GATE-C01-POSITIVE",
      "gate_id": "C01",
      "hold_condition": "Recoverable schema or semantic incompleteness without a fundamental violation.",
      "hold_return_state": "C01",
      "input_schema_ref": "schema/GATE_CONTEXT_SCHEMAS.json#/$defs/GateContextC01",
      "name": "PHENOMENON_BOUNDED",
      "negative_fixture_ref": "fixtures/GATE_FIXTURES.json#/fixtures/C01/negative",
      "next_phase": "C02",
      "owner": "O001",
      "pass_condition": "Schema-valid context, closed runtime evidence, semantic predicate TRUE, exact next-phase transition, and no STOP boundary.",
      "positive_fixture_ref": "fixtures/GATE_FIXTURES.json#/fixtures/C01/positive",
      "predicate": {
        "op": "schema_valid",
        "schema_ref": "schema/GATE_CONTEXT_SCHEMAS.json#/$defs/GateContextC01"
      },
      "required_evidence": [
        "typed CycleObjectStore",
        "current GateEvidence bound to the exact context digest",
        "all declared runtime references resolve in the current cycle and scope"
      ],
      "required_evidence_contract": {
        "allowed_source_classes": [
          "CURRENT_RUNTIME",
          "AUTHORIZED_SOURCE",
          "INDEPENDENT_REVIEW"
        ],
        "context_digest_excludes": [
          "runtime_registry"
        ],
        "exact_cycle_binding": true,
        "exact_revision_binding": true,
        "exact_scope_binding": true,
        "gate_evidence_owner": "O001",
        "gate_evidence_type": "GateEvidence",
        "known_object_types_required": true,
        "minimum_evidence_count": 1,
        "object_bindings": [
          {
            "context_path": "phenomenon",
            "freshness": "CURRENT",
            "id_path": "phenomenon_id",
            "object_type": "Phenomenon",
            "owner": "O001",
            "source_class": "CURRENT_RUNTIME"
          },
          {
            "context_path": "boundary_record",
            "freshness": "CURRENT",
            "id_path": "boundary_record_id",
            "object_type": "BoundaryRecord",
            "owner": "O002",
            "source_class": "CURRENT_RUNTIME"
          }
        ],
        "object_id_uniqueness_required": true,
        "object_payload_required": true,
        "reference_bindings": [
          {
            "context_path": "known",
            "freshness": "CURRENT",
            "minimum_count": 1,
            "object_type": "Fact",
            "owner": "O010",
            "source_class": "AUTHORIZED_SOURCE"
          },
          {
            "context_path": "unknowns",
            "freshness": "CURRENT",
            "minimum_count": 0,
            "object_type": "Unknown",
            "owner": "O001",
            "source_class": "CURRENT_RUNTIME"
          }
        ],
        "registry_lifecycle_state_required": "ACTIVE",
        "registry_path": "runtime_registry",
        "registry_type": "CycleObjectStore",
        "required_freshness": "CURRENT"
      },
      "semantic_predicate": {
        "args": [
          {
            "left_path": "boundary_record.phenomenon_ref",
            "op": "equals",
            "right_path": "phenomenon.phenomenon_id"
          },
          {
            "left_path": "boundary_record.phenomenon_revision",
            "op": "equals",
            "right_path": "phenomenon.revision"
          },
          {
            "left_path": "boundary_record.cycle_id",
            "op": "equals",
            "right_path": "cycle_id"
          },
          {
            "left_path": "boundary_record.scope",
            "op": "equals",
            "right_path": "phenomenon.scope"
          },
          {
            "equals": "O002",
            "op": "fact",
            "path": "boundary_record.owner_ref"
          },
          {
            "equals": "CURRENT",
            "op": "fact",
            "path": "boundary_record.status"
          },
          {
            "equals": "C02",
            "op": "fact",
            "path": "next_transition"
          }
        ],
        "op": "all"
      },
      "stop_condition": "Fundamental invariant violation or prohibition."
    },
    {
      "adversarial_fixture_ref": "fixtures/GATE_FIXTURES.json#/fixtures/C02/adversarial",
      "canonical_object_projection": {
        "assessment_objects": [
          "Context_Package",
          "Authority"
        ],
        "output_objects": [
          "Context_Package"
        ],
        "primary_object": "Context Package"
      },
      "execution_receipt_ref": "validation/PREPACK_TEST_EXECUTION_RECEIPTS.jsonl#test_id=TEST-GATE-C02-POSITIVE",
      "gate_id": "C02",
      "hold_condition": "Recoverable schema or semantic incompleteness without a fundamental violation.",
      "hold_return_state": "C02",
      "input_schema_ref": "schema/GATE_CONTEXT_SCHEMAS.json#/$defs/GateContextC02",
      "name": "GOAL_AND_DVS_CONFIRMED",
      "negative_fixture_ref": "fixtures/GATE_FIXTURES.json#/fixtures/C02/negative",
      "next_phase": "C03",
      "owner": "O003",
      "pass_condition": "Schema-valid context, closed runtime evidence, semantic predicate TRUE, exact next-phase transition, and no STOP boundary.",
      "positive_fixture_ref": "fixtures/GATE_FIXTURES.json#/fixtures/C02/positive",
      "predicate": {
        "op": "schema_valid",
        "schema_ref": "schema/GATE_CONTEXT_SCHEMAS.json#/$defs/GateContextC02"
      },
      "required_evidence": [
        "typed CycleObjectStore",
        "current GateEvidence bound to the exact context digest",
        "all declared runtime references resolve in the current cycle and scope"
      ],
      "required_evidence_contract": {
        "allowed_source_classes": [
          "CURRENT_RUNTIME",
          "AUTHORIZED_SOURCE",
          "INDEPENDENT_REVIEW"
        ],